{
  "procedure": "napoli/comune/tari-iscrizione-non-domestica",
  "form": "mod-5",
  "sha256": "a279e108154002193aec6805d0e957b9d8675755f159e0d7b955540d0a9221ba",
  "font_size": 9,
  "boxes": [
    {
      "label": "Il/La sottoscritto/a",
      "rect": [
        127.2,
        157.1,
        341.0,
        166.4
      ]
    },
    {
      "label": "nato/a",
      "rect": [
        372.9,
        157.1,
        459.3,
        166.4
      ]
    },
    {
      "label": "il",
      "rect": [
        466.8,
        157.1,
        556.1,
        166.4
      ]
    },
    {
      "label": "C.F.",
      "cells": [
        [
          59.4,
          71.0
        ],
        [
          75.8,
          87.0
        ],
        [
          91.8,
          103.0
        ],
        [
          107.8,
          119.1
        ],
        [
          123.9,
          135.1
        ],
        [
          139.9,
          151.1
        ],
        [
          155.9,
          167.1
        ],
        [
          171.9,
          183.3
        ],
        [
          188.1,
          199.3
        ],
        [
          204.1,
          215.3
        ],
        [
          220.1,
          231.3
        ],
        [
          236.1,
          247.3
        ],
        [
          252.1,
          263.3
        ],
        [
          268.1,
          279.3
        ],
        [
          284.1,
          295.3
        ],
        [
          300.1,
          311.5
        ]
      ],
      "baseline": 185.6
    },
    {
      "label": "residente in",
      "rect": [
        369.5,
        177.5,
        559.7,
        188.0
      ]
    },
    {
      "label": "Via",
      "rect": [
        54.2,
        197.7,
        351.2,
        208.2
      ]
    },
    {
      "label": "n°",
      "rect": [
        361.6,
        197.7,
        385.0,
        208.2
      ]
    },
    {
      "label": "Telefono",
      "rect": [
        425.9,
        197.7,
        559.4,
        208.2
      ]
    },
    {
      "label": "e-mail",
      "rect": [
        65.8,
        217.7,
        322.8,
        228.2
      ]
    },
    {
      "label": "pec",
      "rect": [
        340.3,
        217.7,
        563.8,
        228.2
      ]
    },
    {
      "label": "nella sua qualità di (titolare / legale rappresentante)",
      "choices": {
        "titolare": [
          160.0,
          238.8,
          168.9,
          247.9
        ],
        "legale rappresentante": [
          233.0,
          238.8,
          241.9,
          247.9
        ]
      }
    },
    {
      "label": "Ragione Sociale",
      "rect": [
        106.8,
        257.7,
        563.7,
        268.2
      ]
    },
    {
      "label": "C.F. (della ditta)",
      "cells": [
        [
          60.6,
          72.0
        ],
        [
          76.8,
          88.0
        ],
        [
          92.8,
          104.0
        ],
        [
          108.8,
          120.1
        ],
        [
          124.9,
          135.9
        ],
        [
          140.7,
          151.9
        ],
        [
          156.7,
          167.9
        ],
        [
          172.7,
          183.9
        ],
        [
          188.7,
          199.9
        ],
        [
          204.7,
          215.7
        ],
        [
          220.5,
          231.7
        ],
        [
          236.5,
          247.5
        ],
        [
          252.3,
          263.5
        ],
        [
          268.3,
          279.5
        ],
        [
          284.3,
          295.5
        ],
        [
          300.3,
          311.5
        ]
      ],
      "baseline": 287.4
    },
    {
      "label": "PARTITA IVA",
      "cells": [
        [
          381.9,
          393.1
        ],
        [
          397.9,
          409.1
        ],
        [
          413.9,
          425.1
        ],
        [
          429.9,
          441.2
        ],
        [
          446.0,
          457.0
        ],
        [
          461.8,
          473.0
        ],
        [
          477.8,
          489.0
        ],
        [
          493.8,
          505.0
        ],
        [
          509.8,
          520.8
        ],
        [
          525.6,
          536.8
        ],
        [
          541.6,
          552.8
        ]
      ],
      "baseline": 287.4
    },
    {
      "label": "Con sede in via",
      "rect": [
        106.2,
        299.5,
        294.3,
        310.1
      ]
    },
    {
      "label": "Comune di",
      "rect": [
        346.2,
        299.5,
        476.5,
        310.1
      ]
    },
    {
      "label": "CAP",
      "rect": [
        496.9,
        299.5,
        562.1,
        310.1
      ]
    },
    {
      "label": "e-mail (della ditta)",
      "rect": [
        65.8,
        319.5,
        292.1,
        330.1
      ]
    },
    {
      "label": "pec (della ditta)",
      "rect": [
        307.4,
        319.5,
        560.8,
        330.1
      ]
    },
    {
      "label": "a decorrere dal",
      "parts": [
        [
          119.8,
          394.6,
          133.2,
          405.1
        ],
        [
          137.4,
          394.6,
          150.8,
          405.1
        ],
        [
          155.2,
          394.6,
          192.0,
          405.1
        ]
      ]
    },
    {
      "label": "Via (immobili)",
      "rect": [
        53.4,
        410.4,
        517.2,
        420.9
      ]
    },
    {
      "label": "n° (immobili)",
      "rect": [
        530.1,
        410.4,
        563.4,
        420.9
      ]
    },
    {
      "label": "1. Dati catastali – sez.",
      "rect": [
        122.1,
        435.6,
        154.1,
        444.9
      ]
    },
    {
      "label": "1. Dati catastali – fg.",
      "rect": [
        166.0,
        435.6,
        198.0,
        444.9
      ]
    },
    {
      "label": "1. Dati catastali – part.",
      "rect": [
        216.8,
        435.6,
        248.6,
        444.9
      ]
    },
    {
      "label": "1. Dati catastali – sub",
      "rect": [
        263.2,
        435.6,
        287.3,
        444.9
      ]
    },
    {
      "label": "1. superficie in mq",
      "rect": [
        356.4,
        435.6,
        388.5,
        444.9
      ]
    },
    {
      "label": "1. destinazione d'uso",
      "rect": [
        466.5,
        435.6,
        562.5,
        444.9
      ]
    },
    {
      "label": "2. Dati catastali – sez.",
      "rect": [
        121.8,
        454.4,
        153.8,
        463.7
      ]
    },
    {
      "label": "2. Dati catastali – fg.",
      "rect": [
        165.8,
        454.4,
        197.8,
        463.7
      ]
    },
    {
      "label": "2. Dati catastali – part.",
      "rect": [
        216.5,
        454.4,
        248.3,
        463.7
      ]
    },
    {
      "label": "2. Dati catastali – sub",
      "rect": [
        262.9,
        454.4,
        287.1,
        463.7
      ]
    },
    {
      "label": "2. superficie in mq",
      "rect": [
        356.2,
        454.4,
        388.2,
        463.7
      ]
    },
    {
      "label": "2. destinazione d'uso",
      "rect": [
        466.1,
        454.4,
        562.1,
        463.7
      ]
    },
    {
      "label": "Descrizione attività",
      "rect": [
        112.8,
        474.6,
        428.9,
        483.9
      ]
    },
    {
      "label": "codice ateco",
      "rect": [
        479.4,
        474.6,
        563.3,
        483.9
      ]
    },
    {
      "label": "Richiesta di detassazione per la produzione di rifiuti speciali",
      "choices": {
        "Richiesta di detassazione": [
          20.4,
          532.2,
          31.5,
          543.0
        ]
      }
    },
    {
      "label": "Eventuali note",
      "rect": [
        93.8,
        644.4,
        563.7,
        654.9
      ],
      "continuation": [
        [
          38.0,
          660.2,
          565.7,
          669.5
        ],
        [
          38.0,
          674.2,
          565.4,
          683.5
        ],
        [
          38.0,
          688.4,
          566.0,
          697.7
        ]
      ]
    },
    {
      "label": "Cod.Contr.",
      "skip": "Riservato all'ufficio."
    }
  ],
  "signatures": [
    {
      "rect": [
        400.0,
        763.5,
        552.0,
        796.0
      ],
      "date_rect": [
        66.0,
        787.7,
        170.0,
        798.7
      ],
      "page": 1,
      "for": "dichiarante"
    }
  ],
  "unmapped": [
    {
      "box": "Data",
      "rect": [
        66.0,
        787.7,
        170.0,
        798.7
      ],
      "why": "Not a field: the dichiarante dates the form when signing."
    },
    {
      "box": "Firma",
      "rect": [
        382.9,
        787.7,
        557.9,
        798.7
      ],
      "why": "The signature: only the dichiarante."
    }
  ]
}
