{
  "procedure": "napoli/comune/tari-iscrizione-uso-abitativo",
  "form": "mod-1",
  "sha256": "2950daa429f5cfd2e19b03792cf4245638f32c3e8267b55e975443145eb8a218",
  "font_size": 9,
  "boxes": [
    {
      "label": "Il/La sottoscritto/a",
      "rect": [134, 136.1, 346, 146.6]
    },
    {
      "label": "nato/a a",
      "rect": [384, 136.1, 469, 146.6]
    },
    {
      "label": "il",
      "rect": [478, 136.1, 566, 146.6]
    },
    {
      "label": "C.F.",
      "cells": [[65.8, 76.2], [82.0, 92.2], [98.2, 108.2], [114.2, 124.2], [130.2, 140.2], [146.2, 156.2], [162.2, 172.4], [178.2, 188.4], [194.3, 204.5], [210.5, 220.5], [226.5, 236.5], [242.5, 252.7], [258.7, 268.7], [274.7, 284.7], [290.7, 300.7], [306.7, 316.9]],
      "baseline": 165.6
    },
    {
      "label": "residente in",
      "rect": [377, 156.0, 566, 168.2]
    },
    {
      "label": "Via",
      "rect": [55, 177.7, 351, 188.2]
    },
    {
      "label": "n°",
      "rect": [362, 177.7, 385, 188.2]
    },
    {
      "label": "Telefono",
      "rect": [431, 177.7, 564, 188.2]
    },
    {
      "label": "e-mail",
      "rect": [67, 197.7, 323, 208.2]
    },
    {
      "label": "pec",
      "rect": [341, 197.7, 564, 208.2]
    },
    {
      "label": "a decorrere dal",
      "parts": [[140, 286.5, 155, 297.1], [160, 286.5, 175, 297.1], [182, 286.5, 219, 297.1]]
    },
    {
      "label": "qualità di (proprietario / possessore / locatario / altro)",
      "choices": {
        "proprietario": [95.5, 300.9, 108.7, 314.1],
        "possessore": [185.1, 301.6, 198.2, 314.8],
        "locatario": [267.0, 301.4, 280.2, 314.6],
        "altro": [336.4, 302.5, 349.6, 315.7]
      },
      "write": {
        "altro": [380, 302.3, 555, 312.9]
      }
    },
    {
      "label": "Appartamento sito in via",
      "rect": [153, 334.2, 554, 345.3]
    },
    {
      "label": "Sez.",
      "rect": [60, 355.9, 101, 366.5]
    },
    {
      "label": "Foglio",
      "rect": [137, 355.9, 178, 366.5]
    },
    {
      "label": "Part.",
      "rect": [206, 355.9, 248, 366.5]
    },
    {
      "label": "Sub.",
      "rect": [274, 355.9, 311, 366.5]
    },
    {
      "label": "Superficie calpestabile in mq",
      "rect": [446, 355.9, 483, 366.5]
    },
    {
      "label": "Autorimessa/cantinola/posto auto (via, dati catastali, superficie, pertinenza)",
      "rect": [242, 377.1, 555, 388.1]
    },
    {
      "label": "Conviventi (nominativo, luogo e data di nascita, rapporto, codice fiscale)",
      "table": {
        "rows": [[460.7, 474.3], [474.3, 487.9], [487.9, 501.5], [501.5, 514.9], [514.9, 528.5]],
        "columns": {
          "Nominativo": [48, 201],
          "Luogo e data di nascita": [203, 336],
          "Rapporto di parentela o coabitante": [338, 421],
          "Codice fiscale": [423, 558]
        }
      }
    },
    {
      "label": "Coabitanti fuori dallo stato di famiglia (nominativo, luogo e data di nascita, rapporto, codice fiscale)",
      "into_table": "Conviventi (nominativo, luogo e data di nascita, rapporto, codice fiscale)"
    },
    {
      "label": "Richiesta di riduzione del 40% \"Uso stagionale\"",
      "choices": {
        "Richiesta di riduzione del 40%": [38.0, 534.4, 51.2, 547.6]
      }
    },
    {
      "label": "Eventuali note",
      "rect": [99, 617.4, 563, 627.9],
      "continuation": [[38, 633.2, 563, 643.7], [38, 649.0, 562, 659.5], [38, 664.8, 563, 675.3]]
    },
    {
      "label": "Cod.Contr.",
      "skip": "Riservato all'ufficio."
    }
  ],
  "signatures": [
    {
      "rect": [401.1, 729.0, 533.4, 759.0],
      "date_rect": [72.0, 748.5, 172.2, 759.0],
      "page": 1,
      "for": "dichiarante"
    }
  ],
  "unmapped": [
    {
      "box": "Data",
      "rect": [72, 748.5, 170, 760.2],
      "why": "Not a field: the dichiarante dates the form when signing."
    },
    {
      "box": "Firma",
      "rect": [410, 748.5, 535, 760.2],
      "why": "The signature: only the dichiarante."
    },
    {
      "box": "Autorimessa: Sez., Foglio, Part., Sub., Superficie, pertinenza",
      "rect": [38, 399.0, 560, 409.5],
      "why": "The garage is one free-text answer, written on the line above."
    },
    {
      "box": "Uso stagionale: Via, Comune di, CAP of the main home",
      "rect": [38, 581.5, 566, 590.9],
      "why": "Not a field: the main home's address, needed only with the seasonal-use reduction.",
      "needed_when": {
        "field": "Richiesta di riduzione del 40% \"Uso stagionale\"",
        "box": "Richiesta di riduzione del 40%"
      }
    }
  ]
}
